{
  "schema_version": 1,
  "id": "furnace-imp",
  "display_name": "Furnace Imp",
  "license": "project-generated",
  "notes": "Prompt spec for the hot-tempered cast-iron furnace imp avatar; see characters/furnace-imp/avatar.json for the build recipe.",
  "source": {
    "kind": "prompt",
    "prompt": "A hot-tempered little furnace imp robot: a cast-iron pot-belly stove face with jagged flame-crest eyebrows, blazing rectangular ember eyes that glow from within, and a furnace-grate firebox mouth that reveals molten orange light when open. Everything angular and jagged like licking flames, drawn as chunky retro pixel art with flat fills.",
    "background": "#ff00ff",
    "background_tolerance": 96,
    "pixel_grid": "auto"
  },
  "layout": {
    "mode": "bands",
    "row_gap": 10,
    "column_gap": 8,
    "rows": [
      {
        "role": "expression",
        "names": ["neutral", "warm", "joy", "concern"]
      },
      {
        "role": "expression",
        "names": ["surprise", "thoughtful", "skeptical", "determined"]
      },
      {
        "role": "expression",
        "names": ["sleepy", "excited", "embarrassed"]
      },
      {
        "role": "mouth",
        "names": ["sil", "pp", "ff", "th", "dd"]
      },
      {
        "role": "mouth",
        "names": ["kk", "ch", "ss", "nn", "rr"]
      },
      {
        "role": "mouth",
        "names": ["aa", "e", "ih", "oh", "ou"]
      }
    ]
  },
  "rig": {
    "canvas": [80, 60],
    "baseline_y": 43,
    "max_body": [76, 42],
    "mouth": {
      "box": [23, 45, 34, 13],
      "erase": false
    },
    "eyes": {
      "left": [4, 6, 32, 31],
      "right": [44, 6, 32, 31],
      "blink": "none"
    }
  },
  "palette": {
    "max_colors": 4,
    "locked": ["#310800", "#c81d00", "#ff8a00", "#ffe9b0"],
    "despeckle": false
  },
  "expressions": "canonical11",
  "flags": ["breathe"],
  "targets": [
    {
      "id": "cores3-fine",
      "framing": "face_fill",
      "scale": 2,
      "canvas": [80, 60],
      "max_flash_bytes": 48000
    }
  ]
}
